DISTRICTNAME,UNITNAME,Crime_No,Year,RI,Noofvehicle_involved,Accident_Classification,Accident_Spot,Accident_Location,Accident_SubLocation,Accident_SpotB,Main_Cause,Hit_Run,Severity,Collision_Type,Junction_Control,Road_Character,Road_Type,Surface_Type,Surface_Condition,Road_Condition,Weather,Lane_Type,Road_Markings,Spot_Conditions,Side_Walk,Collision_TypeB,Accident_Road,Landmark_first,landmark_second,Distance_LandMark_First,Distance_LandMark_Second,Accident_Description,Latitude,Longitude,Time
Ballari,Kuduthini PS,10445189320230129,2023,1,1,Road Accidents,Offset,Rural Areas,Near Petrol Pump,Straight and flat,Human Error,No,Grievous Injury,Hit pedestrian,Uncontrolled,Others,State Highway,Bitumen(Tar),Dry,No influence on accident,Clear,Others,Centre Broken Line,Centre Broken Line,Concrete,Others,SH29,NEAR JAMBANNA RICEMISS,,70MTR,,ಹಳೇದರೋಜಿ ಗ್ರಾಮದ ಜಂಬಣ್ಣ ರೈಸ್ ಮಿಲ್ ಮುಂದಿನ ಕಂಪ್ಲಿ-ಕುಡುತಿನಿ ರಸ್ತೆಯಲ್ಲಿ,15.269296,76.664876,08:26:20 AM
Ballari,Kuduthini PS,10445189320230132,2023,1,1,Not Applicable,Other,City/Town,Open area,Other,Human Error,Not Applicable,Fatal,Hit bicyclist,Uncontrolled,Others,State Highway,Bitumen(Tar),Dry,Not Applicable,Others,DualLane,Centre Broken Line,Others,Concrete,Overturning,STATE HIGHWAY,NEAR SHEKSHAVALI BRIKS,,1 KM,,NEAR SHEKSHAVALI BRIKS,15.20087,76.75125,05:35:17 PM
Ballari,Kuduthini PS,10445189320230151,2023,1,2,Not Applicable,Other,City/Town,Near Bus stop,Other,Human Error,Not Applicable,Fatal,Hit bicyclist,Not at  Junction,Others,State Highway,Bitumen(Tar),Dry,Not Applicable,Very Cold,Others,Centre White Line,Others,Concrete,Others,KUDUTHINI -KAMPLI ROAD,NEAR AMBEDKAR CIRCLE,,1/2 KM,,NEAR AMBEDKAR CIRCLE KAMPLI-BALLARI ROAD,15.199068,76.755443,07:12:17 AM
Ballari,Kuduthini PS,10445189320230079,2023,1,2,Road Accidents,Other,Rural Areas,Near a factory industrial area,Other,Human Error,No,Simple Injury,Vehicle to Vehicle,Uncontrolled,Straight and flat,NH,Concrete,Dry,No influence on accident,Clear,Others,Centre Broken Line,Centre Broken Line,Concrete,Others,NH67,NEAR KPCL COMPOUND,,30MTR,,ಕುಡುತಿನಿ ಪಟ್ಟಣದ ಹೊರವಲಯದ ಕೆಪಿಸಿಎಲ್ ಬಳಿಯ ರಾಮಾಂಜಿನೇಯ ಗುಡಿ ಹತ್ತಿರದ ಬಳ್ಳಾರಿ ಹೊಸಪೇಟೆ ಎನ್.ಹೆಚ್ 67 ರಸ್ತೆಯಲ್ಲಿ,15.18689,76.72606,05:42:22 AM
Ballari,Kuduthini PS,10445189320230150,2023,1,2,Not Applicable,Other,City/Town,Narrow bridge or culverts,Curve,Human Error,No,Fatal,Others,Not at  Junction,Sharp Curve,NH,Concrete,Others,Construction Work / Material,Clear,DualLane,Centre Broken Line,Centre Broken Line,Concrete,Head on,NH 67 ROAD HOSAPETE BALLARI ROAD,NEAR ADRALA BRIDGE,,1 KM,,Near Adrala bridge,15.192392,76.746664,07:16:56 PM
Ballari,Kurugod PS,10445034320190084,2019,1,1,Road Accidents,Road hump or Rumble strips,Rural Areas,Open area,Other,Human Error,No,Fatal,Others,Uncontrolled,Hump,NH,Bitumen(Tar),Dry,No influence on accident,Clear,Others,Centre Broken Line,Centre Broken Line,Concrete,Skidding or Self accident,NH,1,,12 Km,,ಬೈಕ್ ಸವಾರನು ತನ್ನ ಮೊಟಾರು ಸೈಕಲ್ ಎಪಿ21ಎ.ಎಕ್ಸ್.1699 ನೇದ್ದನ್ನು ಅಜಾಗರುಕತೆ ಮತ್ತು ನಿಲಱಕ್ಷತನದಿಂದ ಚಲಾಯಿಸಿ ಹಂಪ್ಸ್ ಎಗರಿಸಿದ್ದರಿಂದ ಹಿಂದೆ ಕುಳಿತಿದ್ದ ತನ್ನ ಹೆಂಡತಿ ಪಾವಱತಮ್ಮ ಕೆಳಗೆ ಬಿದ್ದು ತಲೆಗೆ ರಕ್ತ ಗಾಯವಾಗಿ ಕಿವಿಯಲ್ಲಿ ರಕ್ತ ಸೋರಿದ್ದರಿಂದ ಬಳ್ಳಾರಿ ವಿಮ್ಸ್ ಆಸ್ಪತ್ರೆಗೆ ದಿ:30.05.2019 ರಂದು ಮದ್ಯಾಹ್ನ 1.00 ಪಿ.ಎಮ್ ಗೆ ದಾಖಲಿಸಿದ್ದು ಅದೇ ದಿನ ಚಿಕಿತ್ಸೆ ಫಲಕಾರಿಯಾಗದೆ ಸಂಜೆ 07:00 ಪಿ.ಎಮ್ ಗಂಟೆಗೆ ಮೃತ ಪಟ್ಟಿರುತ್ತಾಳೆ.,15.366316,76.912582,04:26:23 AM
Ballari,Kurugod PS,10445034320190012,2019,1,2,Road Accidents,Cross roads,Villages settlement,Residential area,,Human Error,Not Applicable,Grievous Injury,Others,No signal lights,Others,One way,Bitumen(Tar),Dry,Not Applicable,Fine,Others,Centre Broken Line,Centre Broken Line,Concrete,Others,KOLURU-MADIRE ROAD,NEAR AGASE,,8 K.M,,"ಈ ಸ್ಥಳವು ಮದಿರೆ ಗ್ರಾಮದ ಬಸ್ ನಿಲ್ದಾಣದ ಹತ್ತಿರವಿರುವ ಮದಿರೆ-ಕುರುಗೋಡು ಕ್ರಾಸ್ ರಸ್ತೆಯಲ್ಲಿನ ಮೋರಿಯ ಹತ್ತಿರ ಕೃತ್ಯ ಸ್ಥಳವಿದ್ದು, ಈ ತಾರ್ ರಸ್ತೆಯು ಸುಮಾರು 08 ಅಡಿ ಅಗಲವಿರುತ್ತದೆ. ಈ ರಸ್ತೆಯು ಉತ್ತರ-ದಕ್ಷಿಣ ಅಭಿಮುಖವಾಗಿರುತ್ತದೆ. ತಾರ್ ರಸ್ತೆಯ ಅಕ್ಕ-ಪಕ್ಕದಲ್ಲಿ ಸುಮಾರು 02 ಅಡಿ ದೂರದವರೆಗೆ ಮಣ್ಣಿನ ರಸ್ತೆ ಇರುತ್ತದೆ. ಕೃತ್ಯ ಸ್ಥಳದಿಂದ ಸುಮಾರು 500 ಅಡಿ ದೂರದಲ್ಲಿ ಉತ್ತರಕ್ಕೆ ಕೋಳೂರು ರಸ್ತೆ ಇರುತ್ತದೆ. ಕೃತ್ಯ ಸ್ಥಳದಿಂದ ಸುಮಾರು 450 ಅಡಿ ದೂರದಲ್ಲಿ ಈಶಾನ್ಯಕ್ಕೆ ಮದಿರೆ ಕ್ರಾಸ್ ಬಸ್ ನಿಲ್ದಾಣ ಇರುತ್ತದೆ. ಸ್ಥಳದಿಂದ ಸುಮಾರು 01 ಕಿ.ಮೀ. ಆಗ್ನೇಯ ದಿಕ್ಕಿಗೆ ಮದಿರೆ ಗ್ರಾಮ ಇರುತ್ತದೆ.",15.288511,76.901665,05:27:18 PM
Ballari,Kurugod PS,10445034320190020,2019,1,1,Not Applicable,Other,Rural Areas,Open area,,Not Applicable,No,Fatal,Others,Uncontrolled,Others,NH,Gravel,Dry,Not Applicable,Others,Others,Centre Broken Line,Centre Broken Line,Concrete,Others,NH 150A,8,,8 K.M,,ಸಿಂಧಿಗೇರಿ ಗ್ರಾಮದ ಮಲ್ಲೇಶ್ವರ ಕ್ಯಾಂಪನಲ್ಲಿರುವ ಪಿರ್ಯಾದಿ ಹೇಮರೆಡ್ಡಿ ರವರ ಮನೆ ಮುಂದಿನ ಬಳ್ಳಾರಿ ಶಿರುಗುಪ್ಪ ರಸ್ತೆಯಲ್ಲಿ,15.366078,76.9126579,11:12:13 AM
Ballari,Kurugod PS,10445034320190193,2019,1,2,Road Accidents,Narrow road,Rural Areas,Open area,Straight and flat,Human Error,No,Grievous Injury,Vehicle to Vehicle,Not at  Junction,Straight and flat,NH,Bitumen(Tar),Dry,Not Applicable,Wind,Others,Centre Broken Line,Centre Broken Line,Concrete,Others,STATE HYWAY 154,1,2,12 KM,,ಪಿರ್ಯಾದಿದಾರರು ಈ ದಿನ ದಿ:24/11/2019 ರಂದು ತಮ್ಮ ಗ್ರಾಮದ ಬಸವರಾಜಸ್ವಾಮಿ ಕೂಡಿ ತನ್ನ ಮೋಟಾರ್ ಸೈಕಲ್ನಲ್ಲಿ ಬಳ್ಳಾರಿಗೆ ಹೋಗಿ ಕೆಲಸ ಮುಗಿಸಿಕೊಂಡು ನಂತರ ವಾಪಾಸ್ ತಮ್ಮ ಗ್ರಾಮಕ್ಕೆ ಹೋಗಲು ಇದೇ ದಿನ ಸಂಜೆ 5:30 ಗಂಟೆ ಸುಮಾರಿಗೆ ಬಳ್ಳಾರಿಯಿಂದ ಹೊರಟಿದ್ದು ಸಂಜೆ 6:15 ಗಂಟೆ ಸುಮಾರಿಗೆ ಕೊಳೂರು ಕ್ರಾಸ್ ದಾಟಿದ ನಂತರ ಇಂಡಿಯನ್ ಆಯಿಲ್ ಪೆಟ್ರೋಲ್ ಬಂಕ್ ಹತ್ತಿರ ಶಿರುಗುಪ್ಪ-ಬಳ್ಳಾರಿ ರಸ್ತೆಯಲ್ಲಿ ಹೋಗುತ್ತಿರುವಾಗ ತನ್ನ ಹಿಂದಿನಿಂದ ಬಳ್ಳಾರಿ ಕಡೆಯಿಂದ ತಮ್ಮ ಗ್ರಾಮದ ವಸಂತಗೌಡ ರವರ ಬುಲೆರೋ ಜೀಪ್ ನಂ ಟಿಎಸ್-09 ಇಹೆಚ್-1567 ನೇದ್ದರಲ್ಲಿ ಹೊರಟಿದ್ದು ಅದೇ ಸಮಯಕ್ಕೆ ಎದುರುಗಡೆಯಿಂದ ಲಾರಿ ನಂ: ಕೆಎ-16 ಎ-5895 ನೇದ್ದರ ಚಾಲಕ ತಾನು ಚಲಾಯಿಸುತ್ತಿದ್ದ ಲಾರಿಯನ್ನು ಅತಿವೇಗ ಮತ್ತು ಅಜಾಗರುಕತೆಯಿಂದ ಚಲಾಯಿಸಿಕೊಂಡು ಬಂದು ವಸಂತಗೌಡ ರವರ ಬುಲೆರೋ ಜೀಪ್ ನಂ ಟಿಎಸ್-09 ಇಹೆಚ್-1567 ನೇದ್ದಕ್ಕೆ ಡಿಕ್ಕಿ ಹೊಡಿಸಿ ಅಪಘಾತಪಡಿಸಿ ಬುಲೆರೋ ಜೀಪ್ ಚಾಲಕ ವಸಂತಗೌಡ ರವರಿಗೆ ಗಾಯಗಳನ್ನುಂಟು ಮಾಡಿ ಲಾರಿ ಚಾಲಕ ಲಾರಿಯನ್ನು ನಿಲ್ಲಿಸಿ ಪರಾರಿಯಾಗಿದ್ದು  ಸದರಿ ಲಾರಿ ನಂ: ಕೆಎ-16 ಎ-5895 ನೇದ್ದರ ಚಾಲಕನ ವಿರುದ್ಧ ಕಾನೂನು ಕ್ರಮ ಜರುಗಿಸಲು ನೀಡಿದ ದೂರಿನ ಮೇರೆಗೆ ಪ್ರಕರಣ ದಾಖಲಿಸಿಕೊಂಡು ತನಿಖೆ ಕೈಗೊಂಡಿರುತ್ತದೆ,15.305427,76.913597,12:46:47 PM
Ballari,Kurugod PS,10445034320190067,2019,1,1,Not Applicable,Curves,Rural Areas,Near Bus stop,Other,Not Applicable,No,Fatal,Hit pedestrian,Controlled,Dip or trough,Others,Bitumen(Tar),Others,Not Applicable,Others,Others,Centre Broken Line,Centre Broken Line,Concrete,Head on,SOMALAPURA CROSS,1,,10,,ಕುರುಗೋಡು ಪೊಲೀಸ್ ಠಾಣಾ ಸರಹದ್ದಿನ ಸೋಮಲಾಪುರ ಕ್ರಾಸ್ ಹತ್ತಿರದ ಚಿಟಿಗಿನಹಾಳ ಸೋಮಲಾಪುರ ಕ್ರಾಸ್ ರಸ್ತೆಯಲ್ಲಿ,15.342057,76.914396,08:52:20 AM
Ballari,Kurugod PS,10445034320190124,2019,1,2,Road Accidents,Other,Rural Areas,Residential area,Straight and flat,Human Error,No,Fatal,Vehicle to Vehicle,Uncontrolled,Straight and flat,NH,Bitumen(Tar),Dry,Not Applicable,Fine,DualLane,Centre Broken Line,Others,Concrete,Others,Siruguppa Ballari road NH-150A,Ramadevara Temple,Basavaraja Tea Hotel,37 ft,20 ft,ಗೋಪಾಲಪುರಂ ಕ್ಯಾಂಪಿನಲ್ಲಿ ಬಸವರಾಜ ರವರ ಟೀ ಹೋಟೇಲ್ ಮುಂದಿನ ಬಳ್ಳಾರಿ ಸಿರುಗುಪ್ಪ ಹೆದ್ದಾರಿ ರಸ್ತೆಯಲ್ಲಿ ಇರುತ್ತದೆ.,15.328582,76.9139489,05:10:13 PM
Ballari,Kurugod PS,10445034320190119,2019,1,1,Road Accidents,Narrow road,Rural Areas,Open area,Other,Vehicle Defect,No,Damage Only,Others,Uncontrolled,Others,One way,Bitumen(Tar),Dry,Not Applicable,Light Rain,Others,Centre Broken Line,Centre Broken Line,Concrete,Others,CHANAL-BYLURU ROAD,CHANAL BYLURU ROAD,,12 KMs,,ಬೈಲೂರು ಗ್ರಾಮದ ಹತ್ತಿರವಿರುವ ಸುಧಾಕರರೆಡ್ಡಿ ರವರ ಜಮೀನಿನ ಮುಂದಿನ ಚಾನಾಳ್-ಬೈಲೂರು ರಸ್ತೆಯಲ್ಲಿ,15.347725,76.917317,03:16:45 PM
Ballari,Kurugod PS,10445034320190151,2019,1,1,Road Accidents,Other,City/Town,Open area,Straight and flat,Human Error,No,Fatal,Hit pedestrian,Uncontrolled,Straight and flat,State Highway,Bitumen(Tar),Dry,Not Applicable,Fine,Others,Centre Broken Line,Others,Not Applicable,Rear end,"Near Kotturswamy Mutt, Kurugodu Kurugodu Kolur Cross Road",Airtel Tower,,50 Ft,,ಕುರುಗೋಡಿನ ಕೊಟ್ಟೂರು ಸ್ವಾಮಿ ಮಠದ ಹತ್ತಿರ ಕುರುಗೋಡು ಕೋಳೂರು ಕ್ರಾಸ್ ರಸ್ರೆಯಲ್ಲಿ ಇರುತ್ತದೆ,15.344254,76.838513,08:04:24 PM
Ballari,Kurugod PS,10445034320190090,2019,1,2,Road Accidents,Narrow road,Rural Areas,Open area,Pot holed,Human Error,No,Grievous Injury,Vehicle to Vehicle,Uncontrolled,Curve,State Highway,Not Applicable,Dry,Not Applicable,Others,Others,Centre Broken Line,Centre Broken Line,Concrete,Others,CHANAL-BYLURU ROAD,CHANAL BYLURU ROAD,BYLURU VILLAGE,15 KMs,,ಬೈಲೂರು ಗ್ರಾಮದ ಮಹೇಶ್ ರೆಡ್ಡಿ ರವರ ಜಮೀನಿನ ಮುಂದಿನ ಚಾನಾಳ್-ಬೈಲೂರು ರಸ್ತೆಯಲ್ಲಿ,15.34772,76.9151639,10:35:40 PM
Ballari,Kurugod PS,10445034320190031,2019,1,1,Not Applicable,Other,Rural Areas,Open area,,Human Error,Not Applicable,Fatal,Others,Uncontrolled,Others,Village Road,Kutcha,Dry,Not Applicable,Others,Others,Centre Broken Line,Centre Broken Line,Concrete,Others,MUDD,1,,10 KM,,KURUGODU POLICE STATION,15.334244,76.914108,03:41:36 PM
Ballari,Kurugod PS,10445034320190209,2019,1,2,Road Accidents,Curves,Rural Areas,Open area,Curve,Human Error,No,Grievous Injury,Vehicle to Vehicle,No signal lights,Curve,NH,Bitumen(Tar),Dry,Not Applicable,Very Cold,Others,Centre Broken Line,Centre Broken Line,Concrete,Others,STATE HYWAY 154(A),1,2,18 KM,,ಬೈಲೂರು ಗ್ರಾಮದ ಬಿ.ಜೆ.ಪಿ. ಕಛೇರಿ ಹತ್ತಿರ ಪೂರ್ವ ದಿಕ್ಕಿನಲ್ಲಿರುವ ಸಾರ್ವಜನಿಕ ರುದ್ರಭೂಮಿ ಮುಂದಿನ ಬಳ್ಳಾರಿ-ಸಿರುಗುಪ್ಪ ಎಸ್.ಹೆಚ್.150(ಎ) ಹೆದ್ದಾರಿ ರಸ್ತೆಯಲ್ಲಿ,15.342837,76.914314,04:13:21 PM
Ballari,Kurugod PS,10445034320210095,2021,1,1,Not Applicable,Other,Rural Areas,Narrow bridge or culverts,Other,Human Error,No,Fatal,Others,Uncontrolled,Others,Others,Bitumen(Tar),Dry,Not Applicable,Others,Others,Centre Broken Line,Centre Broken Line,Concrete,Others,BASAPURA TO SIRIGERI,8KM,,8,,ಬಸಾಪುರ ಗ್ರಾಮದ ಹತ್ತಿರ ಎಲ್ ಎಲ್ ಸಿ ಕಾಲುವೆಯ ಪಕ್ಕದಲ್ಲಿ ಗೆಣಿಕೆಹಾಳ ರಸ್ತೆಯಲ್ಲಿ ಬಳಿ,15.363197,76.844591,10:49:17 PM
Ballari,Kurugod PS,10445034320210170,2021,1,1,Road Accidents,Narrow road,Rural Areas,At pedestrian Crossing,Straight and flat,Human Error,No,Grievous Injury,Hit pedestrian,Signal lights Automatic,Others,NH,Bitumen(Tar),Dry,Not Applicable,Wind,Others,Centre Broken Line,Centre Broken Line,Concrete,Run Off Road,NATIONAL HYWAY,1,2,14,,ಕುರುಗೋಡು ಪೊಲೀಸ್ ಠಾಣಾ ವ್ಯಾಪ್ತಿಯ ಭಾಗ್ಯನಗರ ಕ್ಯಾಂಪ್ ನ ಮಾರೆಮ್ಮ ಗುಡಿ ಮುಂದಿನ ಬಳ್ಳಾರಿ-ಸಿರುಗುಪ್ಪ ರಸ್ತೆಯ ಪಕ್ಕದಲ್ಲಿ,15.253865,76.910521,11:24:55 AM
Ballari,Kurugod PS,10445034320210156,2021,1,1,Road Accidents,Other,Rural Areas,Near Petrol Pump,Bridge,Human Error,No,Simple Injury,Others,Uncontrolled,Straight and flat,NH,Bitumen(Tar),Dry,Not Applicable,Fine,Others,Centre Broken Line,Centre Broken Line,Concrete,Skidding or Self accident,BATRAHALLI HALLAD BRIDGE BALLARI SIRUGUPPA NH ROAD,PETROL BUNK,,300MTR,,ಕೋಳೂರು ಕ್ರಾಸ್ ಹತ್ತಿರ ಭಟ್ರಹಳ್ಳಿ ಹಳ್ಳದ ಬ್ರಿಡ್ಜ್ ಬಳಿ ಬಳ್ಳಾರಿ ಸಿರುಗುಪ್ಪ ರಾಷ್ಟ್ರೀಯ ಹೆದ್ದಾರಿ ರಸ್ತೆಯಲ್ಲಿ ಇರುತ್ತದೆ.,15.302248,76.914476,04:37:37 PM
Ballari,Kurugod PS,10445034320220169,2022,1,2,Road Accidents,Other,Rural Areas,Near or inside a village,Other,Not Applicable,No,Grievous Injury,Vehicle to Vehicle,Uncontrolled,Others,NH,Metalled,Others,Not Applicable,Others,Others,Centre Broken Line,Centre Broken Line,Concrete,Others,NH-150,00,00,100MT,,ಕುರುಗೋಡು ಪೋಲಿಸ್ ಠಾಣಾ ವ್ಯಾಪ್ತಿಯ ಬೈಲೂರು ಗ್ರಾಮದ ಅಯ್ಯಪ್ಪ ಡಾಬಾ ಹತ್ತಿರ ನರ್ಸರಿ ಮುಂದಿನ ಸಿರುಗುಪ್ಪ-ಬಳ್ಳಾರಿ 150(ಎ) ಹೆದ್ದಾರಿ ರಸ್ತೆಯಲ್ಲಿ,15.345078,76.836468,12:11:28 PM
Ballari,Kurugod PS,10445034320230205,2023,1,2,Road Accidents,Curves,Rural Areas,Open area,Pot holed,Human Error,Not Applicable,Simple Injury,Vehicle to Vehicle,Uncontrolled,Curve,NH,Bitumen(Tar),Others,Pot holed,Clear,Others,Centre Broken Line,Centre Broken Line,Concrete,Others,NH 150 A,NEAR VT CAMP,NEAR CHARCH,15 KM,15KM,"ಕುರುಗೋಡು ಠಾಣಾ ಸರಹದ್ದಿನ ವಿ,ಟಿ,ಕ್ಯಾಂಪ್ ಹತ್ತಿರ ಸಿರುಗುಪ್ಪ-ಬಳ‍್ಳಾರಿ ರಾಷ್ಟ್ರೀಯ ಹೆದ್ದಾರಿ 150(ಎ) ರಸ್ತೆಯಲ್ಲಿ.",15.316197,76.912424,08:46:53 AM
Ballari,Kurugod PS,10445034320230179,2023,1,2,Not Applicable,Other,Rural Areas,Near Petrol Pump,Bridge,Human Error,Not Applicable,Fatal,Others,Not at  Junction,Others,NH,Bitumen(Tar),Ditch or Potholed,Drainage Ditch,Clear,SingleLane,Centre Broken Line,Centre Broken Line,Concrete,Others,SIRUGUPPA-BALLARI ROAD,NEAR INDRA NAGARA,NEAR KHANDRA PETROL BANK,12 KM,,NEAR INDIRA NAGARA,15.2077,76.664249,04:40:35 PM
Ballari,Kurugod PS,10445034320230076,2023,1,2,Road Accidents,Other,Rural Areas,Open area,Straight and flat,Human Error,No,Grievous Injury,Vehicle to Vehicle,Uncontrolled,Straight and flat,NH,Bitumen(Tar),Dry,Not Applicable,Clear,Others,Centre Broken Line,Centre Broken Line,Concrete,Head on,NH 150 A,NEAR SOMASAMUDRA VILLAGE,,20,,ಕುರುಗೋಡು ಪೊಲೀಸ್ ಠಾಣಾ ಸರಹದ್ದಿನ ಸೋಮಸಮುದ್ರ ಗ್ರಾಮದ ಹತ್ತಿರ ಎನ್.ಹೆಚ್. 150(ಎ) ರಸ್ತೆಯಲ್ಲಿ.,15.248313,76.909175,11:45:59 PM
Ballari,Kurugod PS,10445034320230136,2023,1,2,Road Accidents,Cross roads,City/Town,Near office complex,Straight and flat,Not Applicable,No,Grievous Injury,Vehicle to Vehicle,No signal lights,Others,Major District Road,Bitumen(Tar),Others,Not Applicable,Clear,Others,Centre Broken Line,Centre Broken Line,Concrete,Overturning,kurugodu badanahatti road,near ujjini hotel badanahatti road,,500 mt,,ಕುರುಗೋಡು ಠಾಣಾ ಸರಹದ್ದಿನ ಬಾದಹಟ್ಟಿ ರಸ್ತೆಯಲ್ಲಿ ಉಜ್ಜಿನಿ ಕ್ಯಾಂಟೀನ್ ಮುಂದುಗಡೆ ರಸ್ತೆಯಲ್ಲಿ,15.343369,76.83406,08:47:56 AM
Ballari,Kurugod PS,10445034320230224,2023,1,1,Road Accidents,Cross roads,Rural Areas,Open area,Pot holed,Vehicle Defect,No,Simple Injury,Others,Uncontrolled,Curve,NH,Bitumen(Tar),Dry,Pot holed,Clear,Others,Centre Broken Line,Centre Broken Line,Concrete,Others,NH 150 (A),BALLARI,SIRUGUPPA,15KM,,ಸದರಿ  ಪ್ರಕರಣದಲ್ಲಿ ಪಂಚನಾಮೆಯನ್ನು ದಿನಾಂಕ:21-12-2023 ರಂದು ಸಂಜೆ 04:00 ಗಂಟೆಯಿಂದ ಸಂಜೆ 05:00 ಗಂಟೆಯವರೆಗೆ ಪಂಚನಾಮೆಯನ್ನು ಮಾಡಿರುತ್ತದೆ,15.330441,76.91368,05:06:31 PM
Ballari,Kurugod PS,10445034320230226,2023,1,1,Not Applicable,Narrow road,Rural Areas,Residential area,Curve,Human Error,No,Fatal,Others,Uncontrolled,Others,Others,Bitumen(Tar),Dry,Not Applicable,Cloudy,Others,Centre Broken Line,Centre Broken Line,Concrete,Others,KURUGODU-KOLURU CROSS ROAD,NEAR ANNPURNESWARI CAMP,,8 KM,,NEAR ANNAPURNESWARI CAMP,15.2077,76.664249,05:52:49 PM
Ballari,Kurugod PS,10445034320230094,2023,1,2,Road Accidents,Curves,Rural Areas,Near or inside a village,Curve,Human Error,Yes,Grievous Injury,Vehicle to Vehicle,Not at  Junction,Curve,One way,Bitumen(Tar),Dry,Construction Work / Material,Others,Others,Centre Broken Line,Centre Broken Line,Concrete,Hit and Run,tar,12,12,15,,ಒರ್ವಾಯಿ ಕ್ರಾಸ್ ಹತ್ತಿರ ವಿರೇಶ ಡಾಬಾ ಕುರುಗೋಡು - ಕಂಪ್ಲಿ ರಸ್ರಯಲ್ಲಿ,15.343507,76.832736,04:28:59 PM
Ballari,Kurugod PS,10445034320230154,2023,1,1,Road Accidents,Other,Rural Areas,Open area,Straight and flat,Not Applicable,No,Fatal,Others,Not at  Junction,Hump,Expressway,Bitumen(Tar),Dry,Drainage Ditch,Others,Others,Centre Broken Line,Centre Broken Line,Concrete,Hit fixed object,KURUGODU TO YARRANGLI ROAD,6 KM,,10 KM,,ಕುರುಗೋಡು ಪೊಲೀಸ್ ಠಾಣಾ ಸರಹದ್ದಿನ  ಯರ್ರಂಗಳಿ ಹೊಲ ಬಳಿ ಕುರುಗೋಡು ಯರ್ರಂಗಳಿ ರಸ್ತೆಯಲ್ಲಿ,15.2077,76.664249,05:32:04 AM
Ballari,Kurugod PS,10445034320230081,2023,1,2,Not Applicable,Other,City/Town,Near Petrol Pump,Other,Not Applicable,No,Grievous Injury,Vehicle to Vehicle,Uncontrolled,Others,Minor District Road,Bitumen(Tar),Others,Not Applicable,Fine,Others,Centre Broken Line,Centre Broken Line,Concrete,Right Turn Collision,BADANAHATTI KURUGODU ROAD,NEAR PETROL BUNK,BADANAHATTI ROAD,2 KM,,"ಎಸ್ಸಾರ್ ಪೆಟ್ರೂಲ್ ಬಂಕ್ ಹತ್ತಿರ, ಬಾದನಹಟ್ಟಿ ರಸ್ತೆ, ಕುರುಗೋಡು",15.339627,76.832564,06:19:16 PM
Ballari,Kurugod PS,10445034320230167,2023,1,1,Not Applicable,Curves,Rural Areas,Open area,Other,Human Error,No,Fatal,Others,Signal lights Automatic,Others,Forest Road,Bitumen(Tar),Muddy,Not Applicable,Others,Others,Centre Broken Line,Centre Broken Line,Concrete,Others,KURUGODU TO SIRIGERI,6 KM,,10 KM,,ಗೆಣಿಕೆಹಾಳ ನಿಂದ ಶಿರಿಗೇರಿಗೆ ಹೋಗುವ ರಸ್ತೆಯಲ್ಲಿ,15.2077,76.664249,05:05:55 AM
Ballari,Kurugod PS,10445034320230175,2023,1,1,Road Accidents,Cross roads,Rural Areas,Open area,Curve,Vehicle Defect,No,Simple Injury,Others,Uncontrolled,Curve,NH,Bitumen(Tar),Dry,Pot holed,Cloudy,Others,Centre Broken Line,Centre Broken Line,Concrete,Rear end,NH 150 A,NEAR CHARG,,100 MT,,ದಿನಾಂಕ; 24/10/2023 ರಂದು ಸಂಜೆ 04:00 ಗಂಟೆಯಿಂದ 05:00 ಗಂಟೆಯವರೆಗೆ ಕೃತ್ಯಸ್ಥಳದಲ್ಲಿ ಪಂಚನಾಮೆಯನ್ನು ಮಾಡಲಾಗಿರುತ್ತದೆ,15.319381,76.914723,01:13:19 PM
Ballari,Kurugod PS,10445034320230182,2023,1,2,Not Applicable,Other,Rural Areas,Open area,Other,Human Error,Not Applicable,Fatal,Others,Not at  Junction,Hump,State Highway,Bitumen(Tar),Dry,Not Applicable,Cloudy,SingleLane,Centre White Line,Others,Concrete,Others,kampi-kurugodu road,near wel come board,,4 km,,Near wel come Board Kampli-Kurugodu Road,15.2077,76.664249,07:48:30 PM
Ballari,Kurugod PS,10445034320230209,2023,1,2,Not Applicable,Other,City/Town,Near Bus stop,Other,Human Error,No,Fatal,Vehicle to Vehicle,Uncontrolled,Others,Expressway,Gravel,Dry,Not Applicable,Dust Storm,DualLane,Centre Broken Line,Others,Concrete,Head on,BALLARI-SIRUGUPPA ROAD,NEAR VT CAMP,,12 KM,,NEAR PETROLA BANK,15.2077,76.664249,08:00:03 AM
Ballari,Moka PS,10445034220190047,2019,1,2,Road Accidents,Other,Rural Areas,Open area,Other,Not Applicable,No,Simple Injury,Vehicle to Vehicle,No signal lights,Others,Others,Bitumen(Tar),Others,Not Applicable,Fine,Others,Centre Broken Line,Centre Broken Line,Concrete,Others,TAR ROAD,000001,000002,10,,ಪೊಲೀಸ್ ಠಾಣಾ ವ್ಯಾಪ್ತಿಯ ಬಳ್ಳಾರಿ-ಬಿ.ಡಿ.ಹಳ್ಳಿ-ಚಾಗನೂರು ರಸ್ತೆಯಲ್ಲಿ ಬರುವ ಆಶೋಕನಗರ ಕ್ಯಾಂಪ್‌ನ ಡಿ.ರಾಮರೆಡ್ಡಿ ರವರ ಹೊಲದ ಹತ್ತಿರ,15.199364,77.017732,04:01:29 PM
Ballari,Moka PS,10445034220190074,2019,1,1,Road Accidents,Other,Rural Areas,Near a religious place,Straight and flat,Human Error,No,Fatal,Others,Uncontrolled,Others,Minor District Road,Bitumen(Tar),Wet,Not Applicable,Mist or Fog,Others,Centre Broken Line,Centre Broken Line,Concrete,Others,MOKA - BASARAKODU ROAD,NEAR SANNA SUNKAPPA FILEDS,,100,,ಮೋಕ ಠಾಣಾ ಸರಹದ್ದಿನ ಮೋಕ-ಬಸರಕೋಡು ರಸ್ತೆಯ ಕೆ.ಕೆ. ಹಾಳ್ ಗ್ರಾಮದ ಗಾದಿಲಿಂಗಪ್ಪ ಗುಡಿ ಹತ್ತಿರ ಇವರು ಕೆ.ಕೆ. ಹಾಳ್ ಸಣ್ಣ ಸುಂಕಪ್ಪ ರವರ ಹೊಲದ ಹತ್ತಿರ ರಸ್ತೆಯಲ್ಲಿ.,15.274599,77.048354,06:07:49 AM
Ballari,Moka PS,10445034220190076,2019,1,1,Road Accidents,Other,Rural Areas,Open area,Curve,Human Error,Not Applicable,Fatal,Others,Uncontrolled,Slight Curve,Minor District Road,Bitumen(Tar),Dry,No influence on accident,Clear,Others,Centre Broken Line,Centre Broken Line,Concrete,Skidding or Self accident,TAR ROAD,INFRONT OF KUMBARA AYYAPPA FIELDS,,100,,ಮೋಕ ಠಾಣಾ ಸರಹದ್ದಿನ ಕೊರ್ಲಗುಂದಿ-ದಮ್ಮೂರು ರಸ್ತೆಯಲ್ಲಿನ ಶ್ರೀ ಕಂಭಾರ ಅಯ್ಯಪ್ಪ ರವರ ಜಮೀನಿನ ಮುಂದಿನ ಡಾಂಬರ್ ರಸ್ತೆಯಲ್ಲಿ.,15.282032,76.974079,05:22:43 AM
Ballari,Moka PS,10445034220190005,2019,1,1,Road Accidents,Other,Villages settlement,Near Bus stop,,Not Applicable,No,Simple Injury,Others,Not at  Junction,Others,Village Road,Kutcha,Dry,Not Applicable,Clear,Others,Centre Broken Line,Centre Broken Line,Concrete,Others,SINDUVALA VILLAGE BUS STOP,SINDUVAL VILLAGE,,1,,ಮೋಕ ಪೊಲೀಸ್ ಠಾಣೆಯ ವ್ಯಾಪ್ತಿಯ ಸಿಂಧುವಾಳ ಗ್ರಾಮದ ಶ್ರೀ ಹೆಚ್. ರಾಮಲಿಂಗಪ್ಪ ರವರ ಖಾಲಿ ಜಾಗದಲ್ಲಿ ಚಕ್‌ಬಂದಿಯನ್ನು ನೋಡಲು ಪೂರ್ವಕ್ಕೆ ಸಿಂಧುವಾಳ ಗ್ರಾಮದ ಒಳಗೆ ಹೋಗುವ ಮತ್ತು ಸಿಂಧುವಾಳ ಕ್ರಾಸ್ ಕಡೆ ಹೋಗುವ ರಸ್ತೆ ಇರುತ್ತದೆ. ಪಶ್ಚಿಮಕ್ಕೆ ಶ್ರೀಮತಿ ನಾರಾಯಣಮ್ಮ ರವರ ಮನೆ ಇರುತ್ತದೆ. ಉತ್ತರಕ್ಕೆ ಶ್ರೀ ಕುಮಾರಪ್ಪ ರವರ ಮನೆಯ ಹಿಂದಿನ ಖಾಲಿ ಜಾಗ ಇರುತ್ತದೆ ಮತ್ತು ದಕ್ಷಿಣಕ್ಕೆ ಶ್ರೀ ಹೆಚ್.ರಾಮಲಿಂಗಪ್ಪ ರವರ ಗೋಡಾನ್ ಇರುತ್ತದೆ.,15.31396,77.074749,08:11:41 AM
