DISTRICTNAME,UNITNAME,Crime_No,Year,RI,Noofvehicle_involved,Accident_Classification,Accident_Spot,Accident_Location,Accident_SubLocation,Accident_SpotB,Main_Cause,Hit_Run,Severity,Collision_Type,Junction_Control,Road_Character,Road_Type,Surface_Type,Surface_Condition,Road_Condition,Weather,Lane_Type,Road_Markings,Spot_Conditions,Side_Walk,Collision_TypeB,Accident_Road,Landmark_first,landmark_second,Distance_LandMark_First,Distance_LandMark_Second,Accident_Description,Latitude,Longitude,Time
Ballari,Moka PS,10445034220230111,2023,1,2,Road Accidents,Narrow road,Rural Areas,Open area,Other,Not Applicable,Not Applicable,Simple Injury,Vehicle to Vehicle,Uncontrolled,Others,State Highway,Bitumen(Tar),Others,Not Applicable,Others,Others,Centre Broken Line,Others,Concrete,Others,TARA ROAD,NEAR HOSA MOKA WEL COME GET,,1 KM,,ಮೋಕ ಠಾಣೆ ಸರಹದ್ದಿನ ಶಿವಪುರು ಎಲ್.ಎಲ್.ಸಿ ಕಾಲುವೆ ಹತ್ತಿರ ಪಂಚರ ಸಮಕ್ಷಮ ಪಂಚನಾಮೆ,15.223844,77.035119,12:24:38 PM
Ballari,P.D. Halli PS,10445033920200002,2020,1,1,Road Accidents,Other,Rural Areas,Open area,Other,Human Error,Not Applicable,Simple Injury,Others,Not at  Junction,Others,NH,Not Applicable,Others,Not Applicable,Others,Others,Centre Broken Line,Centre Broken Line,Concrete,Others,NH 167,Near Karekallu,,10 KM,,"ಕಾರೆಕಲ್ಲು ಗ್ರಾಮದ ಹತ್ತಿರ ಓಂಕಾರ ಸ್ವಾಮಿ ಜಮೀನು ಮುಂದಿನ ಎನ್ ಹೆಚ್ 167 ರಸ್ತೆ, ಬಳ್ಲಾರಿ ತಾ,",15.211032,77.130052,12:50:12 PM
Ballari,P.D. Halli PS,10445033920200005,2020,1,2,Road Accidents,Other,Rural Areas,Open area,Other,Human Error,Not Applicable,Grievous Injury,Vehicle to Vehicle,Uncontrolled,Others,NH,Bitumen(Tar),Dry,Not Applicable,Fine,Others,Centre Broken Line,Centre Broken Line,Concrete,Head on,NH-63 Near Yeriswami Land Chelagurki Village,NH,,10 km,,"ಠಾಣಾ ಸರಹದ್ದಿನ ಬಳ್ಳಾರಿ ತಾಲೂಕು ಚೆಲಗುರ್ಕಿ ಗ್ರಾಮದ ಬಳಿಯ ಎರಿಸ್ವಾಮಿ ರವರ ಹೊಲದ ಹತ್ತಿರದ ಎನ್.ಹೆಚ್.-63 ತಾರ್ ರಸ್ತೆ ಕೃತ್ಯ ಸ್ಥಳವಾಗಿರುತ್ತದೆ. ಈ ಕೃತ್ಯ ಸ್ಥಳಕ್ಕೆ ಚೆಕ್ ಬಂದಿಯು ಪೂರ್ವಕ್ಕೆ ಅನಂತಪುರ ರಸ್ತೆ, ಪಶ್ಚಿಮಕ್ಕೆ ಬಳ್ಳಾರಿ ರಸ್ತೆ , ಉತ್ತರ-ದಕ್ಷಿಣಕ್ಕೆ ಸದರಿ ಎರಿಸ್ವಾಮಿ ರವರ ಹೊಲ ಕಂಡುಬರುತ್ತದೆ.",15.110324,77.141004,07:11:06 PM
Ballari,P.D. Halli PS,10445033920200008,2020,1,1,Road Accidents,Other,Rural Areas,Open area,Other,Human Error,No,Grievous Injury,Others,Uncontrolled,Others,NH,Bitumen(Tar),Dry,Not Applicable,Clear,Others,Centre Broken Line,Centre Broken Line,Not Applicable,Others,NH,Near Challagurki Village,,13,,"Infront of Hanumana Gouda Land, NH-63, Near Chellagukri Village, Ballari Taluk",15.093678,77.150172,06:31:55 PM
Ballari,P.D. Halli PS,10445033920200016,2020,1,2,Road Accidents,Other,Rural Areas,Open area,Straight and flat,Human Error,No,Fatal,Vehicle to Vehicle,Uncontrolled,Straight and flat,NH,Bitumen(Tar),Dry,Not Applicable,Clear,Others,Centre Broken Line,Centre Broken Line,Concrete,Others,BALLARI - ANANTPUR ROAD,CHARCH,,300,,GODEHAL VILLAGE OUT SCOT OPP KARDI TIPPAIAH LAND BALLARI - ANANTHPUR NH 63 ROAD,15.11535,77.074123,10:29:01 AM
Ballari,P.D. Halli PS,10445033920200007,2020,1,1,Road Accidents,Other,Rural Areas,Open area,Other,Human Error,No,Grievous Injury,Others,Uncontrolled,Others,NH,Not Applicable,Others,Not Applicable,Others,Others,Centre Broken Line,Centre Broken Line,Concrete,Others,NH,Near Basai Facotry,,8,,"Near Bashi Factory, NH-167 Road, Ballari",15.187724,77.101084,12:55:55 PM
Ballari,P.D. Halli PS,10445033920200003,2020,1,1,Road Accidents,Other,Rural Areas,Open area,Straight and flat,Human Error,Not Applicable,Grievous Injury,Hit pedestrian,Not at  Junction,Others,NH,Bitumen(Tar),Dry,Not Applicable,Fine,Others,Centre Broken Line,Centre Broken Line,Concrete,Others,NH 63 ROAD NEAR Chalgurki Cross Joladarashi Village,NH,,8 KM,,"ಠಾಣಾ ಸರಹದ್ದಿನ  ಬಳ್ಳಾರಿ ತಾಲೂಕು ಜೋಳದರಾಶಿ ಗ್ರಾಮದ ಬಳಿಯ  ಚೆಳಗುರ್ಕಿ ಕ್ರಾಸ್ ಹತ್ತಿರ ಗುಂತಕಲ್ - ಬಳ್ಳಾರಿ NH-63 ರಸ್ತೆ ಸ್ಥಳ ಕೃತ್ಯ ಸ್ಥಳವಾಗಿರುತ್ತದೆ. ಈ ಸ್ಥಳಕ್ಕೆ ಚೆಕ್ಕ ಬಂದಿಯು ಪೂರವ- ಪಶ್ಚಿಮಕ್ಕೆ NH-63 ರಸ್ತೆ, ಉತ್ತರಕ್ಕೆ ತಿಮ್ಮಪ್ಪ ರವರ ಹೊಲ,  ಹೊಸ ರ್ಸತೆಯ ನಂತರ ರಾಮಣ್ಣ ರವರ ಹೊಲ ಕಂಡುಬರುತ್ತದೆ.",15.132128,77.133592,06:20:22 PM
Ballari,P.D. Halli PS,10445033920210091,2021,1,2,Road Accidents,Curves,Rural Areas,Open area,Curve,Human Error,Not Applicable,Damage Only,Vehicle to Vehicle,Uncontrolled,Others,NH,Surfaced,Dry,Not Applicable,Clear,Others,Centre Broken Line,Centre Broken Line,Concrete,Others,NH,SHIDIGINAMOLA,,SHIDIG,,"ಗೌರಮ್ಮ ರವರ ಜಮೀನು ಮುಂದೆ, ಎನ್.ಹೆಚ್.167, ಶಿಡಿಗಿನಮೊಳ ಗ್ರಾಮ, ಬಳ್ಳಾರಿ.",15.177384,77.0784039,02:02:38 PM
Ballari,P.D. Halli PS,10445033920210117,2021,1,1,Road Accidents,Other,Rural Areas,Open area,Straight and flat,Human Error,No,Grievous Injury,Hit pedestrian,Not at  Junction,Straight and flat,NH,Bitumen(Tar),Dry,Not Applicable,Others,DualLane,Centre White Line,Others,Concrete,Others,NH 167 ROAD NEAR  Basai Factory Karekallu Village Ballari TQ,NH,,10 KM,,"ದಿನಾಂಕ:03/12/2021 ರಂದು ಈ ಪ್ರಕರಣದ ತನಿಖೆಯನ್ನು ಮುಂದುವರೆಸಿ ಈ ಪ್ರಕರಣದ ದೂರುದಾರರಾದ ಶ್ರೀ ಧರ್ಮ ಗೊಂಡ್ ತಂದೆ ಭೂತುರ್ ಗೊಂಡ್ ವ-20 ವರ್ಷ, ಗೊಂಡ್ ಜನಾಂಗ, ಕೂಲಿ ಕೆಲಸ ವಾಸ- ತಲಪಲಟರಾಯ್ ಗ್ರಾಮ, ಗೋಪಾಲ ಗಂಜ್ ಪೋಸ್ಟ್, ಬೊಧಚ್ಚಪರ್, ಗೋಪಾಲಗಂಜ್  ಜಿಲ್ಲಾ, ಬಿಹಾರ್ ರಾಜ್ಯ ಹಾಲಿ ವಾಸ- A-1 ಸ್ಟೀಲ್ ಪ್ಯಾಕ್ಟರಿ ಕ್ಯಾಂಪ್, ಕಾರೆಕಲ್ಲು ಗ್ರಾಮ, ಬಳ್ಳಾರಿ ತಾ,  ರವರೊಂದಿಗೆ ಈ ಪ್ರಕರಣದಲ್ಲಿ ಕೃತ್ಯ ಸ್ಥಳಕ್ಕೆ ಈ ದಿನ ಬೆಳೆಗ್ಗೆ 10-20 ಗಂಟೆಗೆ ಭೇಟಿ ನೀಡಿ, ಖುದ್ದಾಗಿ ಕೃತ್ಯ ಸ್ಥಳಕ್ಕೆ ಇಬ್ಬರು ಪಂಚರಾದ 1] ಶ್ರೀ ಬಿ.ಪಿ ಲಿಂಗಪ್ಪ ತಂದೆ ತಿಮ್ಮಪ್ಪ ವ-63 ವರ್ಷ, ವಾಲ್ಮೀಕಿ ಜನಾಂಗ, ವ್ಯವಸಾಯ ವೃತ್ತಿ ವಾಸ- ಮೀನಹಳ್ಳಿ ಗ್ರಾಮ, ಬಳ್ಳಾರಿ ತಾ 2] ಶ್ರೀ ಕೆ ವೀರಪ್ಪ ತಂದೆ ನಾರಾಯಣಪ್ಪ ವ-60 ವರ್ಷ, ವಾಲ್ಮೀಕಿ ಜನಾಂಗ, ವ್ಯವಸಾಯ ವೃತ್ತಿ ವಾಸ- ಮೀನಹಳ್ಳಿ ಗ್ರಾಮ,ಬಳ್ಳಾರಿ ತಾ ರವರನ್ನು ಬರಮಾಡಿಕೊಂಡು ಪಿರ್ಯಾದಿದಾರರು ಹೇಳಿ ತೋರಿಸಿದ ಕೃತ್ಯ ಸ್ಥಳದಲ್ಲಿ ಈ ದಿನ ಬೆಳೆಗ್ಗೆ 10-30 ಗಂಟೆಯಿಂದ 10-45 ಗಂಟೆ ವರೆಗೆ ವಿವರವಾದ ಕೃತ್ಯ ಪಂಚನಾಮೆಯನ್ನು ಜರುಗಿಸಿಕೊಂಡಿರುತ್ತೇನೆ. ನಂತರ ಸ್ಥಳದ ವಿವರವನ್ನು ಪರಿಶೀಲಿಸಿನೋಡಲು ಸ್ಥಳವು ಬಳ್ಳಾರಿ ತಾ ಕಾರೆಕಲ್ಲು ಗ್ರಾಮದ ಹತ್ತಿರ ಹಗರಿ–ಚಿಂತಕುಂಟ ಎಪಿ ನಡುವಿನ ಎನ್.ಹೆಚ್.167 ರಸ್ತೆಯು ಕೃತ್ಯ ಸ್ಥಳವಾಗಿರುತ್ತದೆ. ಸದರಿ ಕೃತ್ಯ ಸ್ಥಳದ ರಸ್ತೆಯು ಅಂದಾಜು 30 ಅಡಿ ತಾರ್ ರಸ್ತೆಯಾಗಿದ್ದು ಕೃತ್ಯ ಸ್ಥಳದಿಂದ ಉತ್ತರಕ್ಕೆ 6 ಅಡಿ, ದಕ್ಷಿಣಕ್ಕೆ 24 ಅಡಿ ರಸ್ತೆ ಕಂಡು ಬರುತ್ತದೆ. ಕೃತ್ಯ ಸ್ಥಳದ ಚೆಕ್ ಬಂಧಿಯನ್ನು ನೋಡಲು ಪೂರ್ವಕ್ಕೆ: ಕಾರೆಕಲ್ಲು, ಚಿಂತಕುಂಟ ಎಪಿ ಕಡೆಗೆ ಹೋಗುವ ರಸ್ತೆ, ಪಶ್ಚಿಮಕ್ಕೆ: ಶಿಡಿಗಿನಮೊಳ ಬಳ್ಳಾರಿ ಕಡೆಗೆ ಹೋಗುವ ರಸ್ತೆ, ಉತ್ತರಕ್ಕೆ ರಸ್ತೆ ನಂತರ ಕಾರೆಕಲ್ಲು ವೀರನಗೌಡ ರವರ ಹೊಲ, ದಕ್ಷಿಣಕ್ಕೆ ರಸ್ತೆ ನಂತರ ಕಾರೆಕಲ್ಲು ವೀರನಗೌಡ ರವರ ಹೊಲ ಕಂಡು ಬರುತ್ತದೆ. ಈ ಕೃತ್ಯ ಸ್ಥಳದಿಂದ ಪಶ್ಚಿಮಕ್ಕೆ ಸುಮಾರು 150 ಮೀಟರ್ ಅಂತರದಲ್ಲಿ ಕೆಪಿಜೆ ಕಟ್ಟಡ ಕಂಡು ಬರುತ್ತದೆ. ನಂತರ ಕೃತ್ಯ ಸ್ಥಳದಲ್ಲಿಯೇ ಪೋಟೋ ತೆಗೆಯಿಸಿಕೊಳ್ಳಲಾಯಿತು. ಮತ್ತು ಕಚ್ಚ ನಕ್ಷೆಯನ್ನು ತಯಾರಿಸಿಕೊಳ್ಳಲಾಯಿತು.",15.196269,77.107244,06:11:50 AM
Ballari,P.D. Halli PS,10445033920230089,2023,1,1,Road Accidents,Other,Rural Areas,Open area,Straight and flat,Human Error,No,Fatal,Others,Uncontrolled,Straight and flat,Minor District Road,Bitumen(Tar),Dry,No influence on accident,Clear,Others,Centre Broken Line,Centre Broken Line,Concrete,Skidding or Self accident,K VEERAPURA - CHELLAGURKI CROSS,BESIDE FIELDS,,100 Mt,,ಪಿ.ಡಿ. ಹಳ್ಳಿ ಠಾಣಾ ಸರಹದ್ದಿನ ಚಳ್ಳಗುರ್ಕಿ ಕ್ರಾಸ್ ದಿಂದ ಕೆ. ವೀರಾಪುರ ಗ್ರಾಮದ ರೈಲ್ವೇ ನಿಲ್ದಾಣದ ಕಡೆಗೆ ಹೋಗುವ ಕೆ. ವೀರಾಪುರ-ಚಳ್ಳಗುರ್ಕಿ ಕ್ರಾಸ್ ಡಾಂಬರ್ ರಸ್ತೆಯ ಸ್ಥಳದಲ್ಲಿ,15.14742,77.12531,08:40:09 PM
Ballari,P.D. Halli PS,10445033920230084,2023,1,1,Road Accidents,Other,Rural Areas,Open area,Straight and flat,Human Error,No,Fatal,Vehicle to Vehicle,Uncontrolled,Straight and flat,NH,Bitumen(Tar),Dry,No influence on accident,Clear,DualLane,Centre Broken Line,Others,Concrete,Hit pedal cyclist,CHELLAGURKI - CHIKKALAGURKI,NEAR CHELLAGURKI VILLAGE,,500 Mt,,ಪಿ.ಡಿ. ಹಳ್ಳಿ ಠಾಣಾ ಸರಹದ್ದಿನ ಚಳ್ಳಗುರ್ಕಿ ಗ್ರಾಮದಿಂದ ಆಂಧ್ರ ಪ್ರದೇಶದ ಗಡಿ ಭಾಗದ ಕಡೆಗೆ ಹೋಗುವ NH-167 ರಸ್ತೆಯಲ್ಲಿನ ಹೊಸಮನೆ ಭೀಮನಗೌಡ ರವರಿಗೆ ಸಂಬಂಧಿಸಿದ ಜಮೀನಿನ ಮಧ್ಯದಲ್ಲಿ ಹಾದು-ಹೋದ ಬಳ್ಳಾರಿ-ಅನಂತಪುರ ಡಾಂಬರ್ ರಸ್ತೆಯಲ್ಲಿ.,15.115185,77.135261,02:27:37 AM
Ballari,P.D. Halli PS,10445033920230065,2023,1,2,Road Accidents,Other,Rural Areas,Open area,Straight and flat,Human Error,No,Simple Injury,Vehicle to Vehicle,Not at  Junction,Straight and flat,NH,Bitumen(Tar),Dry,Not Applicable,Fine,Others,Centre Broken Line,Centre Broken Line,Concrete,Head on,Nh167,Near Gowdon,,8,,"ಈ ದಿನ ದಿನಾಂಕ: 05/10/2023 ರಂದು ಈ ಪ್ರಕರಣದ ಪಿರ್ಯಾದಿದಾರ ಶ್ರೀ ಪ್ರವೀಣ್ ಕುಮಾರ್ ಎಸ್. ರವರೊಂದಿಗೆ ಕೃತ್ಯ ಸ್ಥಳವಾದ ಠಾಣಾ ಸರಹದ್ದಿನ ಬಳ್ಳಾರಿ ತಾಲೂಕು ಶಿಡಿಗಿನಮೊಳ ಗ್ರಾಮದ ಗಂಗಾಧರ ರವರ ಗೋಡೆನ ಬಳಿಯ NH-167 ರಸ್ತೆಯ ಸ್ಥಳಕ್ಕೆ ಈ ದಿನ 16-05 ಗಂಟೆಗೆ ಹೋಗಿ ಪರಿಶೀಲಿಸಿ ಇಬ್ಬರು ಪಂಚರಾದ 1] ಶ್ರೀ ಅಯ್ಯಪ್ಪ ಟಿ ತಂದೆ ತಿಮ್ಮಪ್ಪ ವ-55 ವರ್ಷ, ವಾಲ್ಮೀಕಿ ಜಾತಿ, ವ್ಯವಸಾಯ ವೃತ್ತಿ ವಾಸ- ಕಮ್ಮಣ್ಣರ ಓಣಿ, ಮೀನಹಳ್ಳಿ ಗ್ರಾಮ, ಬಳ್ಳಾರಿ ತಾಲೂಕು, 2] ಶ್ರೀ ಕೆ ವೀರಪ್ಪ ತಂದೆ ನಾರಾಯಾಣಪ್ಪ ವ-70 ವರ್ಷ, ವಾಲ್ಮೀಕಿ ಜಾತಿ, ವ್ಯವಸಾಯ ವೃತ್ತಿ ವಾಸ- ಕಟಿಗೆಗೇರಿ ಓಣಿ, ಮೀನಹಳ್ಳಿ ಗ್ರಾಮ, ಬಳ್ಳಾರಿ ತಾಲೂಕು ಇವರಿಗೆ ಖುದ್ದಾಗಿ ಪೊಲೀಸ್ ನೋಟೀಸ್ ಜಾರಿ ಮಾಡಿ ಕೃತ್ಯ ಸ್ಥಳಕ್ಕೆ ಬರಮಾಡಿಕೊಂಡು ಸದರಿ ಪಿರ್ಯಾದಿದಾರ ಶ್ರೀ ಪ್ರವೀಣ್ ಕುಮಾರ್ ಎಸ್. ರವರು ಹೇಳಿ ತೋರಿಸಿದ ಕೃತ್ಯ ಸ್ಥಳದಲ್ಲಿ ಈ ದಿನ ದಿನಾಂಕ: 05/10/2023 ರಂದು 16-15 ಗಂಟೆಯಿಂದ 17-00 ಗಂಟೆಯ ವರೆಗೆ ಕೃತ್ಯ ಸ್ಥಳದ ಪಂಚನಾಮೆಯನ್ನು ಜರುಗಿಸಲಾಯಿತು. ಸದರಿ ಕೃತ್ಯ ಸ್ಥಳವು ಠಾಣಾ ಸರಹದ್ದಿನ ಬಳ್ಳಾರಿ ತಾಲೂಕು ಶಿಡಿಗಿನಮೊಳ ಗ್ರಾಮದ ಗಂಗಾಧರ ರವರ ಗೋಡೆನ ಬಳಿಯ NH-167 ತಾರ್ ರಸ್ತೆಯ ಸ್ಥಳ ಕೃತ್ಯ ಸ್ಥಳವಾಗಿದ್ದು, ಈ ಕೃತ್ಯ ಸ್ಥಳದ ರಸ್ತೆಯು ಪಶ್ಚಿಮ- ಪೂರ್ವಾಭಿಮುಖವಾಗಿದ್ದು ಇದ್ದು, ಈ ಕೃತ್ಯ ಸ್ಥಳದಿಂದ ರಸ್ತೆಯು ಉತ್ತರಕ್ಕೆ15 ಅಡಿ ರಸ್ತೆ, ದಕ್ಷಿಣಕ್ಕೆ 15 ಅಡಿ ರಸ್ತೆ ಕಂಡು ಬರುತ್ತದೆ, ಕೃತ್ಯ ಸ್ಥಳದಿಂದ ಕುಬೇರ ದಿಕ್ಕಿಗೆ ಅಂದಾಜು 150 ಮೀಟರ್ ಅಂತರದಲ್ಲಿ ಶಿಡಿಗಿನಮೊಳ ಗ್ರಾಮದ ಗಂಗಾಧರ ರವರ ಗೋಡೆನ ಕಂಡುಬರುತ್ತದೆ,",15.184554,77.089195,07:35:55 PM
Ballari,P.D. Halli PS,10445033920230061,2023,1,1,Road Accidents,Other,Rural Areas,Open area,Straight and flat,Human Error,No,Fatal,Others,Not at  Junction,Straight and flat,Minor District Road,Bitumen(Tar),Dry,No influence on accident,Clear,Others,Centre Broken Line,Centre Broken Line,Concrete,Skidding or Self accident,YALPI-RUPANAGUDI,NEAR KUNTANAHAL,,1 KM,,ಕುಂಟನಾಳ್ ಗ್ರಾಮದ ಬಳಿ,15.084,77.06126,09:49:00 AM
Ballari,P.D. Halli PS,10445033920230072,2023,1,1,Road Accidents,Other,Rural Areas,Open area,Straight and flat,Human Error,No,Grievous Injury,Others,Not at  Junction,Straight and flat,NH,Concrete,Dry,Not Applicable,Fine,DualLane,Centre Broken Line,Centre Broken Line,Concrete,Skidding or Self accident,NH67,Near Gammon,,1KM,,"ದಿನಾಂಕ:16/11/2023 ರಂದು, ಈ ಪ್ರಕರಣದ ಗಾಯಾಳು ಶ್ರೀಮತಿ ಕೆ. ಮಹಾಲಕ್ಷ್ಮೀ ಗಂಡ ನವೀನ್ ವ-19 ವರ್ಷ, ಕುರುಬರ ಜಾತಿ, ಗೃಹಿಣಿ, ವಾಸ- ಬೇವಿನಹಳ್ಳಿ ಗ್ರಾಮ, ಬಳ್ಳಾರಿ ತಾಲೂಕು & ಜಿಲ್ಲೆ. ರವರನ್ನು ಇಬ್ಬರು ಪಂಚರಾದ 1] ಶ್ರೀ ರಾಮೂರ್ತಿ ತಂದೆ ಲಕ್ಷ್ಮಣ ವ-23ವರ್ಷ, ಕುರಬರ ಜಾತಿ, ವ್ಯವಸಾಯ ಕೆಲಸ ವಾಸ- 2ನೇ ವಾರ್ಡ, ಹನುಮಂತರಾಯನ ಬೀದಿ, ಕಕ್ಕಬೇವಿನ ಗ್ರಾಮ ಬಳ್ಳಾರಿ (ತಾ)& (ಜಿ). 2] ಶ್ರೀ ಕೆ. ಗಣೇಶ ತಂದೆ ಲಕ್ಷ್ಮಣ ವ-25 ವರ್ಷ, ಕುರಬರ ಜಾತಿ, ಪಾಕ್ಯರಿ ವರ್ಕರ್ (ಜಿಂದಾಲ್), ವಾಸ- 4ನೇ ವಾರ್ಡ, ಕುರಬರ ಓಣಿ, ಚೆಳ್ಳಗುರ್ಕಿ ಗ್ರಾಮ ಬಳ್ಳಾರಿ (ತಾ)& (ಜಿ). ರವರನ್ನು ಪೊಲೀಸ್ ನೋಟೀಸ್ ಮೂಲಕ ಕೃತ್ಯ ಸ್ಥಳಕ್ಕೆ ಬರಮಾಡಿಕೊಂಡು ಗಾಯಾಳು/ಸಾಕ್ಷಿದಾರರಾದ ಮಹಾಲಕ್ಷ್ಮೀಯು ಹೇಳಿ ತೋರಿಸಿದ ಕೃತ್ಯ ಸ್ಥಳದಲ್ಲಿ ಈ ದಿನ 16-15 ಗಂಟೆಯಿಂದ 17-00 ಗಂಟೆ ವರೆಗೆ ವಿವರವಾದ ಕೃತ್ಯ ಸ್ಥಳದ ಪಂಚನಾಮೆಯನ್ನು ಜರುಗಿಸಿಕೊಂಡಿರುತ್ತೇನೆ. ನಂತರ ಸ್ಥಳದ ವಿವರವನ್ನು ಪರಿಶೀಲಿಸಿ ನೋಡಲು ಸ್ಥಳವು ಠಾಣಾ ಸರಹದ್ದಿನ ಬಳ್ಳಾರಿ ತಾಲೂಕಿನ ಪಿ.ಡಿ ಹಳ್ಳಿ ಗ್ರಾಮದ ಗ್ಯಾಮೆನ್ ಕಂಪನಿ ಬಳಿಯ NH-67 ನೇದ್ದರ ಸಿಸಿ ರಸ್ತೆಯಾಗಿದ್ದು, ಈ ರಸ್ತೆಯು ಪೂರ್ವ-ಪಶ್ಚಿಮಾಭಿಮುಖವಾಗಿರುವ 24 ಅಡಿ ಅಗಲದ ರಸ್ತೆಯಾಗಿದ್ದು, ಕೃತ್ಯ ಸ್ಥಳದಿಂದ 8 ಅಡಿ ದಕ್ಷಿಣಕ್ಕೆ 16 ಅಡಿ ಉತ್ತರಕ್ಕೆ ಅಂತರ ಇರುತ್ತದೆ. ಈ ರಸ್ತೆಯು ವಾಹನಗಳ ಸಂಚಾರಕ್ಕೆ ಯೋಗ್ಯವಾದ (ಸುಗಮವಾದ) ರಸ್ತೆಯಾಗಿರುತ್ತದೆ. ಈ ಸ್ಥಳದಿಂದ ಆಗ್ನೇಯ ದಿಕ್ಕಿಗೆ 150 ಮೀ ಅಂತರದಲ್ಲಿ  ಗ್ಯಾಮೇನ್ ಕಂಪನಿ ಗೇಟ್ ಇರುತ್ತದೆ.  ಈ ಕೃತ್ಯ ಸ್ಥಳದ ಚೆಕ್ ಬಂಧಿಯನ್ನು ನೋಡಲು ಪಶ್ಚಿಮಕ್ಕೆ: ಪಿ.ಡಿ ಹಳ್ಳಿ, ಬಳ್ಳಾರಿ ಕಡೆಗೆ ಹೋಗುವ ರಸ್ತೆ, ಪೂರ್ವಕ್ಕೆ: ಗುಂತಕಲ್- ಅನಂತಪುರ ಆಂದ್ರದ ಕಡೆಗೆ ಹೋಗುವ ರಸ್ತೆ, ಉತ್ತರಕ್ಕೆ ರಸ್ತೆ ನಂತರ ಪಿ.ಡಿ ಹಳ್ಳಿಯ ಅಂಗಡಿ ಭೀಮಪ್ಪ ರವರ ಹೊಲ, ದಕ್ಷಿಣಕ್ಕೆ ರಸ್ತೆ ನಂತರ ಸದರಿ ಗ್ಯಾಮೆನ್ ಕಂಪನಿ ಬಯಲು ಜಾಗ ಕಂಡು ಬರುತ್ತದೆ, ನಂತರ ಕೃತ್ಯ ಸ್ಥಳದಲ್ಲಿ ಪೋಟೋ ತೆಗೆಯಿಸಿಕೊಳ್ಳಲಾಯಿತು ಮತ್ತು ಕಚ್ಚ ನಕ್ಷೆಯನ್ನು ತಯಾರಿಸಿಕೊಳ್ಳಲಾಯಿತು.",15.142439,77.067331,05:22:42 PM
Ballari,Sandur PS,10445036620190104,2019,1,1,Road Accidents,Offset,Rural Areas,Near a factory industrial area,Straight and flat,Not Applicable,No,Others,Others,Uncontrolled,Straight and flat,Forest Road,Kutcha,Others,Not Applicable,Fine,DualLane,Centre Broken Line,Others,Not Applicable,Drowned,RAMGAD MINES,RAMGAD VILLAGE,,20,,RAMGAD MINES,15.133136,76.456841,03:07:42 AM
Ballari,Sandur PS,10445036620190142,2019,1,2,Road Accidents,Narrow road,Rural Areas,Open area,Other,Vehicle Defect,Yes,Fatal,Vehicle to Vehicle,Uncontrolled,Others,State Highway,Kutcha,Dry,Not Applicable,Fine,Others,Centre Broken Line,Centre Broken Line,Concrete,Hit and Run,Sandur-Toranagallu Road,15ft,,200m,,ಕೃಷ್ಣನಗರ ಗ್ರಾಮದ ಬಾಬಯ್ಯ ಕ್ರಾಸ್ ದಾಟಿದ ನಂತರ ಸುಮಾರು 200ಮೀಟರ್ ದೂರದಲ್ಲಿ ಸಂಡೂರು-ತೋರಣಗಲ್ಲು ರಸ್ತೆಯ ಕೃತ್ಯ ನಡೆದ ಸ್ಥಳವಾಗಿರುತ್ತದೆ.,15.083334,76.5881456,08:57:43 PM
Ballari,Sandur PS,10445036620190111,2019,1,2,Road Accidents,Narrow road,Rural Areas,Near a factory industrial area,Straight and flat,Not Applicable,No,Grievous Injury,Vehicle to Vehicle,Uncontrolled,Straight and flat,Others,Kutcha,Others,Not Applicable,Fine,Others,Centre Broken Line,Centre Broken Line,Concrete,Hit parked vehicle,BKG MINES AT SANDUR,BKG MINES AT SANDUR,,6,,CHECK POST AT BKG MINES YARD SANDUR,15.343,76.3138,06:56:34 PM
Ballari,Sandur PS,10445036620200016,2020,1,2,Road Accidents,Narrow road,Rural Areas,Open area,Other,Human Error,No,Fatal,Hit pedestrian,Uncontrolled,Incline,Others,Kutcha,Dry,Not Applicable,Others,Others,Centre Broken Line,Centre Broken Line,Concrete,Hit parked vehicle,Vesco Mince Area at near Dharmapur village Sandur tq,12f,,150f,,ಸಂಡೂರು ಪೊಲೀಸ್ ಠಾಣೆ ಸರಹದ್ದಿನ ಬರುವ ಧರ್ಮಾಪುರ  ಗ್ರಾಮದ  ವೆಸ್ಕೋ ಮೈನ್ಸ್ ನ ಕಬ್ಬಿಣದ ಅದಿರು ಲೋಡ್  ಮಾಡಲು ಸರದಿ ಸಾಲಿನಲ್ಲಿ ನಿಂತಿದ್ದ ಸ್ಥಳ ಕೃತ್ಯಸ್ಥಳವಾಗಿರುತ್ತದೆ.,15.097008,76.484308,08:38:53 PM
Ballari,Sandur PS,10445036620200008,2020,1,2,Road Accidents,Cross roads,Rural Areas,Open area,Straight and flat,Not Applicable,No,Simple Injury,Others,Uncontrolled,Slight Curve,Others,Concrete,Others,Not Applicable,Fine,DualLane,Centre Broken Line,Others,Not Applicable,Others,SANDUR - KUDLIGI ROAD,VESCO MINES CROSS,,6,,VESCO CROSS MINES AT DHARMAPUR VILLAGE,15.062555,76.523729,05:48:48 PM
Ballari,Sandur PS,10445036620230134,2023,1,1,Not Applicable,Other,City/Town,Open area,Other,Not Applicable,Not Applicable,Others,Others,Uncontrolled,Others,Others,Concrete,Dry,Not Applicable,Others,Others,Centre Broken Line,Centre Broken Line,Concrete,Others,CC Road,Half KM,,500 M,,"Sandur To Kudligi Main Road, Near Goudara shop",15.082174,76.543518,11:35:30 AM
Ballari,Sandur PS,10445036620230152,2023,1,1,Road Accidents,Narrow road,Rural Areas,Open area,Other,Human Error,No,Simple Injury,Others,Uncontrolled,Others,Others,Concrete,Others,Not Applicable,Others,Others,Centre Broken Line,Centre Broken Line,Concrete,Side swipe,SH-40,1,,1,,ಸಂಡೂರು-ಹೊಸಪೇಟೆ ಬೈಪಾಸ್ ರಸ್ತೆಯಲ್ಲಿ ರಸ್ತೆಯ ಪಕ್ಕದ ಬ್ರೀಡ್ಜ್ ಗೆ.,15.04342,76.3359,05:52:13 AM
Ballari,Sandur PS,10445036620230153,2023,1,1,Road Accidents,Narrow road,Rural Areas,Open area,Other,Not Applicable,No,Fatal,Others,Uncontrolled,Others,Others,Concrete,Others,Not Applicable,Others,Others,Centre Broken Line,Centre Broken Line,Concrete,Others,SH 40,Near Krishna Nagara Village,,2 Kms,,ಸಂಡೂರು ಪೊಲೀಸ್ ಠಾಣಾ ಸರಹದ್ದಿನಲ್ಲಿ,15.100261,76.559888,05:01:59 PM
Ballari,Sandur PS,10445036620230148,2023,1,2,Not Applicable,Cross roads,Rural Areas,Open area,Curve,Not Applicable,Not Applicable,Grievous Injury,Vehicle to Vehicle,Uncontrolled,Others,Others,Concrete,Others,Not Applicable,Others,Others,Centre Broken Line,Centre Broken Line,Not Applicable,Others,CC Road,Near Gandi Maliyamma Temple,,6,,-,15.055301,76.513263,03:11:20 AM
Ballari,Sandur PS,10445036620230009,2023,1,2,Road Accidents,Curves,Rural Areas,Open area,Curve,Not Applicable,Not Applicable,Simple Injury,Others,Uncontrolled,Curve,Others,Concrete,Others,Not Applicable,Others,Others,Centre Broken Line,Centre Broken Line,Concrete,Others,"Deogiri To Subrayanahalli Main road,",15KM,,15,,"Deogiri To Subrayanahalli Main road, Near KMK  East paint",14.999312,76.57488,10:12:37 AM
Ballari,Sandur PS,10445036620230125,2023,1,2,Road Accidents,Other,Rural Areas,In bazaar,Other,Not Applicable,No,Fatal,Vehicle to Vehicle,Uncontrolled,Others,Others,Concrete,Others,Not Applicable,Others,Others,Centre Broken Line,Centre Broken Line,Concrete,Others,SH 40,Near Sushila Nagara Village,,06 Kms,,ಸಂಡೂರು ಠಾಣಾ ಸರಹದ್ದಿನಲ್ಲಿ,15.124293,76.492803,11:46:28 AM
Ballari,Sandur PS,10445036620230150,2023,1,2,Not Applicable,Curves,Rural Areas,Open area,Curve,Human Error,Not Applicable,Simple Injury,Others,Uncontrolled,Crest of hill,Others,Concrete,Dry,Not Applicable,Others,Others,Centre Broken Line,Centre Broken Line,Concrete,Overturning,Rural Roads,1,,1,,ಕುಮಾರಸ್ವಾಮಿ-ನಂದಿಹಳ್ಳಿ ಮೈನ್ಸ್ ಗುಡ್ಡದ ಇಳಿಜಾರು ಸಿಮೆಂಟ್ ರಸ್ತೆಯಲ್ಲಿ  ಹರಿಶಂಕರ ಗುಡಿ ದಾಟಿ ಮುಂದೆ ಇಳಿಜಾರು ರಸ್ತೆಯಲ್ಲಿ,15.04342,76.3359,01:33:32 AM
Ballari,Sandur PS,10445036620230122,2023,1,1,Road Accidents,Other,City/Town,Near Bus stop,Other,Human Error,Not Applicable,Simple Injury,Hit pedestrian,Controlled,Others,Others,Bitumen(Tar),Dry,Not Applicable,Fine,Others,Centre Broken Line,Centre Broken Line,Concrete,Others,S H 40,1,,1,,ಸಂಡೂರು ಠಾಣಾ ವ್ಯಾಪ್ತಿಯ ಸಂಡೂರು ಪಟ್ಟಣದ ಪುರಸಭೆ ಬಸ್ ನಿಲ್ದಾಣದ ಬಳಿ.,15.08455,76.544467,09:26:08 AM
Ballari,Sandur PS,10445036620230104,2023,1,2,Not Applicable,Curves,Rural Areas,Open area,Curve,Not Applicable,Not Applicable,Others,Others,Not at  Junction,Curve,Others,Concrete,Others,Not Applicable,Others,Others,Centre Broken Line,Centre Broken Line,Concrete,Others,Near Cross,8,,6 KM,,Near Muraripur Cross,15.140671,77.573397,02:58:48 AM
